{
  "contract_id": "io-source-snapshot-v1",
  "snapshot_type": "forecast",
  "snapshot_id": "normal_consumption:forecast",
  "content_hash": "11cbb45ef5f6a32d1cdfc701e328e4ba6f3b2fbb50a5fdc7a030e4e19626ddd7",
  "adapter": "DSDM_FORECAST_V1",
  "origin_type": "DEVELOPMENT_FIXTURE",
  "source_reference": "TEST-ONLY",
  "source_as_of_date": "2026-09-28",
  "status": "SEALED",
  "row_count": 3,
  "metadata": {
    "company_cd": "DSE",
    "subs_cd": "C100",
    "site_cd": "V101",
    "demand_run_id": "91930a93-8601-4b71-9736-1d404f44c6ff",
    "demand_run_status": "SUCCEEDED",
    "evidence_status": "VERIFIED",
    "calendar_snapshot_id": "normal_consumption:calendar",
    "calendar_content_hash": "c9f3a3534ea47cb412536b6d289fe4b5b3859f62a54c19376f03fc12522411fe",
    "master_snapshot_revision": "MASTER-R1",
    "master_content_hash": "0df3404e409727f6488543e0724272683d13e8f9748c103b5871613e882f579e"
  },
  "semantics": {
    "selector": {
      "company_cd": "DSE",
      "subs_cd": "C100",
      "site_cd": "V101",
      "demand_run_id": "91930a93-8601-4b71-9736-1d404f44c6ff",
      "tenant_id": "default",
      "project_id": "TEST-PROJECT",
      "plant_cd": "V101",
      "plan_id": "TEST-PLAN",
      "plan_yyyyww": "202639",
      "fcst_w0_yyyyww": "202640",
      "target_cd": "DMD",
      "bukt_cd": "W",
      "snrio_id": "BASE",
      "snrio_grp": "BASE",
      "regul_type": "NORMAL",
      "forecast_stat_cd": "MEAN",
      "forecast_from_yyyyww": "202640",
      "forecast_to_yyyyww": "202642"
    },
    "netting_mode": "SAME_BUCKET_CONSUMPTION",
    "approval_reference": "TEST-NETTING"
  },
  "rows": [
    {
      "company_cd": "DSE",
      "subs_cd": "C100",
      "site_cd": "V101",
      "plant_cd": "V101",
      "plan_id": "TEST-PLAN",
      "plan_yyyyww": "202639",
      "fcst_w0_yyyyww": "202640",
      "target_cd": "DMD",
      "bukt_cd": "W",
      "snrio_id": "BASE",
      "snrio_grp": "BASE",
      "regul_type": "NORMAL",
      "forecast_stat_cd": "MEAN",
      "result_id": "1",
      "model_run_id": "TEST-MODEL",
      "oper_part_no": "A",
      "fcst_yyyyww": "202642",
      "fcst_qty": "0",
      "source_profile_sha256": "1111111111111111111111111111111111111111111111111111111111111111",
      "input_manifest_sha256": "2222222222222222222222222222222222222222222222222222222222222222",
      "model_run_status": "SUCCEEDED"
    },
    {
      "company_cd": "DSE",
      "subs_cd": "C100",
      "site_cd": "V101",
      "plant_cd": "V101",
      "plan_id": "TEST-PLAN",
      "plan_yyyyww": "202639",
      "fcst_w0_yyyyww": "202640",
      "target_cd": "DMD",
      "bukt_cd": "W",
      "snrio_id": "BASE",
      "snrio_grp": "BASE",
      "regul_type": "NORMAL",
      "forecast_stat_cd": "MEAN",
      "result_id": "2",
      "model_run_id": "TEST-MODEL",
      "oper_part_no": "A",
      "fcst_yyyyww": "202640",
      "fcst_qty": "110",
      "source_profile_sha256": "1111111111111111111111111111111111111111111111111111111111111111",
      "input_manifest_sha256": "2222222222222222222222222222222222222222222222222222222222222222",
      "model_run_status": "SUCCEEDED"
    },
    {
      "company_cd": "DSE",
      "subs_cd": "C100",
      "site_cd": "V101",
      "plant_cd": "V101",
      "plan_id": "TEST-PLAN",
      "plan_yyyyww": "202639",
      "fcst_w0_yyyyww": "202640",
      "target_cd": "DMD",
      "bukt_cd": "W",
      "snrio_id": "BASE",
      "snrio_grp": "BASE",
      "regul_type": "NORMAL",
      "forecast_stat_cd": "MEAN",
      "result_id": "3",
      "model_run_id": "TEST-MODEL",
      "oper_part_no": "A",
      "fcst_yyyyww": "202641",
      "fcst_qty": "20",
      "source_profile_sha256": "1111111111111111111111111111111111111111111111111111111111111111",
      "input_manifest_sha256": "2222222222222222222222222222222222222222222222222222222222222222",
      "model_run_status": "SUCCEEDED"
    }
  ]
}
